{
	"schemaVersion": "equipment-image-target-v2",
	"targetId": "material-equipment-v2-hard-leather-light-armour-full-set-v2",
	"productionId": "material-equipment-v2",
	"profileId": "equipment-material-visual-profile-v2",
	"manifestCanonicalSha256": "129a7389e272b83d234b7b49551a23ca0405a83d0b760701fe645cc0e6454441",
	"allocationCanonicalSha256": "80dacf129b7aa9269b1f2852bf55d320799a301829d05c9c29bacf6aaacc483d",
	"profileCanonicalSha256": "a7f2703b3fe513fc80ebf46f7e1b173bb90c35466eb2e45d0d23932d319e55c8",
	"profileAcceptanceCanonicalSha256": "96fad622da53b742f359bb1b9860773b12d7ea93cb1dd6786f4ae8b943087bdf",
	"material": {
		"id": "hard-leather",
		"name": "Hard Leather",
		"family": "hide-scale",
		"rank": "E",
		"craftsmanship": "Standard"
	},
	"equipment": {
		"class": "light-armour",
		"artifactRole": "set-source",
		"slot": null
	},
	"classDirection": {
		"description": "hide- or scale-dominant mobile protection",
		"anchorReferenceId": "coarse-hide-armour-camera",
		"pose": "match the full-set camera and empty display anchor",
		"proportionRules": [
			"mobile close-fitting silhouette",
			"must not read as Heavy Armour"
		],
		"consistencyLock": [
			"camera",
			"pivot",
			"normalized-scale",
			"presentation-angle"
		]
	},
	"consistencySource": null,
	"references": [
		{
			"referenceId": "remy-finish-style",
			"path": "assets/heroes/visuals/forge-v2/benchmarks/remy-esen-equipped-v1.png",
			"contentHash": "9c726ad578a6a6d8ed510a7e7117443ce471e553d233b36a8c20afedddd1040d",
			"usage": "style-only",
			"purpose": "Painterly finish, honest wear, material response, cold key, restrained warm rim, floor, and midnight-charcoal background only; do not transfer Remy or her design."
		},
		{
			"referenceId": "coarse-hide-armour-camera",
			"path": "assets/equipment/experiments/material-equipment-v1/candidates/f/coarse-hide/light-armour-full-set-v1.png",
			"contentHash": "b3b973ffa5eec4fb7f0125202b16b845cd271feec5c5d1351ebd55bfb7fef247",
			"usage": "camera-and-display-only",
			"purpose": "Full-set facing, mild three-quarter camera, stance, pivot, and camera height only; re-scale to the v2 framing target. Do not copy its support form, body impression, hood void, interior treatment, material, garment design, or old framing."
		}
	],
	"presentation": {
		"mode": "complete-armour-set",
		"subject": "empty-self-supporting-armour-set",
		"composition": "Full body in a mild three-quarter front view, approximately 15 degrees toward frame-left. Match the anchor facing, stance, pivot, and camera height, then re-scale toward the 8% composition target without crossing the 5% hard minimum. Exactly Head, Torso, Legs, and paired Boots must be readable together.",
		"canvas": {
			"width": 1024,
			"height": 1536,
			"mediaType": "image/png"
		},
		"framing": {
			"compositionTargetPercent": 8,
			"hardMinimumPercent": 5,
			"priority": "pose-consistency-over-margin-above-hard-minimum"
		},
		"interior": "natural-interior-cavity-shadow-only",
		"requiredComponents": [
			"Head",
			"Torso",
			"Legs",
			"Boots"
		],
		"negativeConstraints": [
			"no-subject-transfer",
			"no-published-character-resemblance",
			"no-visible-body",
			"no-visible-mannequin",
			"no-black-void-figure",
			"no-horizontal-floor-pose",
			"no-mirrored-class-pose",
			"no-rarity-rainbow",
			"no-gold-inflation",
			"no-full-object-glow",
			"no-oversized-silhouettes",
			"no-ornament-as-material-identity",
			"no-extra-gear",
			"no-text",
			"no-labels",
			"no-ui",
			"no-borders",
			"no-frames",
			"no-logos",
			"no-watermarks"
		]
	},
	"acceptanceCriteria": [
		{
			"criterionId": "v2-framing",
			"category": "canvas-and-framing",
			"description": "Aim for 8% clearance, never cross the 5% hard minimum, and preserve the class pose once the minimum is met.",
			"required": true
		},
		{
			"criterionId": "expected-object-component-count",
			"category": "object-count",
			"description": "The image contains exactly the required object, pair, or four Armour components.",
			"required": true
		},
		{
			"criterionId": "equipment-class-silhouette",
			"category": "equipment-silhouette",
			"description": "The silhouette reads immediately as the declared Equipment class.",
			"required": true
		},
		{
			"criterionId": "class-pose-lock",
			"category": "class-pose-consistency",
			"description": "Camera, pivot, normalized scale, and presentation angle match the class lock.",
			"required": true
		},
		{
			"criterionId": "structural-plausibility",
			"category": "structural-plausibility",
			"description": "Construction, joins, fastenings, grip, coverage, balance, and weight are plausible.",
			"required": true
		},
		{
			"criterionId": "rank-bearing-material-dominance",
			"category": "material-dominance",
			"description": "The declared material is dominant and supplies the only visible rank.",
			"required": true
		},
		{
			"criterionId": "material-cue-strength",
			"category": "material-cue-strength",
			"description": "Physical construction cues establish the material beyond palette.",
			"required": true
		},
		{
			"criterionId": "bounded-rank-behaviour",
			"category": "bounded-rank-behaviour",
			"description": "Any supernatural material behaviour is bounded and never becomes full-object glow.",
			"required": true
		},
		{
			"criterionId": "profile-style-cohesion",
			"category": "style-cohesion",
			"description": "Finish, wear, lighting, background, and construction follow the accepted profile.",
			"required": true
		},
		{
			"criterionId": "negative-constraint-safety",
			"category": "negative-constraint-safety",
			"description": "Every declared negative constraint is satisfied.",
			"required": true
		},
		{
			"criterionId": "empty-full-set",
			"category": "empty-armour-display",
			"description": "The complete set is empty and self-supporting with natural cavity shadow only: no body, mannequin, or void figure.",
			"required": true
		}
	],
	"output": {
		"candidatePath": "assets/equipment/experiments/material-equipment-v2/candidates/e/hard-leather/light-armour-full-set-v2.png",
		"provenanceResultPath": "assets/equipment/experiments/material-equipment-v2/results/e/hard-leather/light-armour-full-set-v2.json"
	}
}
